[{"Flush Lever Location": "Top - Chrome Finish Dual Flush Buttons", "Toilet Length": "27.4 inches", "Serial Number:": "1691", "Toilet Width": "15 inches", "Flush Type": "Siphonic", "Toilet Height": "30 inches", "Toilet Seat Included": "Yes", "Stock Status:": "In Stock", "Sale Price:": "$ 549.99 ON SALE", "Gallons per Flush": "1.6 Gallon Full Flush/ 0.8 Gallon Half Flush", "Toilet Design Style": "Oval", "Warranty": "1 Year", "Rough-in Size": "12 inches", "Toilet Type": "One Piece Toilet", "click to see larger image Name: Ballino - Dual Flush Modern Bathroom Toilet Normal Price: $800.00 Sale Price: $ 549.99 ON SALE Serial Number: 1691 Manufacturer Name: The Interior Gallery Stock Status: In Stock Quantity To Order": "Dual Flush Modern Bathroom Toilet Description Ballino is a designer modern bathroom toilet that embraces the latest trend in luxury modern bathroom design. The ultra-modern one piece toilet features a sophisticated water-saving dual flush system and S-Trap design. The fashionable style toilet features a sleek design with contemporary components. The one piece bathroom toilet design will provide contemporary functionality and introduce beauty and elegance to any modern bathroom decor. Toilet Features: Soft Close Toilet Seat One Piece Toilet S Trap: 12 inch Rough In Eco Friendly Dual Flush Toilet (1.6 Gallon Full Flush/ 0.8 Gallon Half Flush) Smooth Glazed, Scratch Resistant. Surface Anti rust, Anti Rust, Anti Discolor Fully Glazed Concealed Trap Way Powerful, Quiet Flush Every Time 15.4 inch Comfort Seat Height FACTORY DIRECT PRICE Toilet Specifications: Toilet Type One Piece Toilet Toilet Bowl Shape Elongated Toilet Design Style Oval Toilet Seat Included Yes Flush Type Siphonic Installation Type Floor Mounted Rough-in Size 12 inches Flush Lever Location Top - Chrome Finish Dual Flush Buttons Toilet Color White Gallons per Flush 1.6 Gallon Full Flush/ 0.8 Gallon Half Flush Toilet Length 27.4 inches Toilet Width 15 inches Toilet Height 30 inches Toilet Seat Height 15.4 inches Toilet Material Ceramic Items Included Bowl, Tank, Flush Lever, Flush Valve, Soft Close Seat, Installation Hardware Warranty 1 Year Usually ships within 1-2 business days via Freight Truck Dual Flush Modern Toilets - Porcelain Toilets", "Normal Price:": "$800.00", "Items Included": "Bowl, Tank, Flush Lever, Flush Valve, Soft Close Seat, Installation Hardware", "Installation Type": "Floor Mounted", "Toilet Color": "White", "Toilet Seat Height": "15.4 inches", "Manufacturer Name:": "The Interior Gallery", "Name:": "Ballino - Dual Flush Modern Bathroom Toilet", "Toilet Material": "Ceramic", "Toilet Bowl Shape": "Elongated"}]